{
  "key": "benchmark_0",
  "name": "Benchmark-0 (this is custom metrics test)",
  "metadata": [
    {
      "key": "goos",
      "name": "GOOS",
      "value": "darwin"
    },
    {
      "key": "goarch",
      "name": "GOARCH",
      "value": "amd64"
    }
  ],
  "metrics": [
    {
      "key": "N",
      "name": "Number of iterations",
      "value": 1000
    },
    {
      "key": "NsPerOp",
      "name": "Nanoseconds per iteration",
      "value": 676.5,
      "unit": " ns/op"
    }
  ]
}